question_id	Response_ID	Annotation_ID	span_type	span_text	relevance_label
Q04150	R005038	6	Ayah	وَإِذَا جَاءَهُمْ أَمْرٌ مِّنَ الْأَمْنِ أَوِ الْخَوْفِ أَذَاعُوا بِهِ ۖ وَلَوْ رَدُّوهُ إِلَى الرَّسُولِ وَإِلَىٰ أُولِي الْأَمْرِ مِنْهُمْ لَعَلِمَهُ الَّذِينَ يَسْتَنبِطُونَهُ مِنْهُمْ	1
Q04150	R005038	7	matn	حَدِّثُوا النَّاسَ بِمَا يَعْرِفُونَ، أَتُحِبُّونَ أَنْ يُكَذَّبَ اللَّهُ وَرَسُولُهُ؟	1
Q01354	R005039	1	Ayah	وَمَا مِن دَابَّةٍ فِي الْأَرْضِ إِلَّا عَلَى اللَّهِ رِزْقُهَا وَيَعْلَمُ مُسْتَقَرَّهَا وَمُسْتَوْدَعَهَا ۚ كُلٌّ فِي كِتَابٍ مُّبِينٍ	1
Q01354	R005039	2	Ayah	وَفِي السَّمَاءِ رِزْقُكُمْ وَمَا تُوعَدُونَ	1
Q01354	R005039	3	Ayah	إِنَّ اللَّهَ هُوَ الرَّزَّاقُ ذُو الْقُوَّةِ الْمَتِينُ	1
Q01354	R005039	4	Ayah	اللَّهُ يَبْسُطُ الرِّزْقَ لِمَن يَشَاءُ وَيَقْدِرُ ۚ وَفَرِحُوا بِالْحَيَاةِ الدُّنْيَا وَمَا الْحَيَاةُ الدُّنْيَا فِي الْآخِرَةِ إِلَّا مَتَاعٌ	1
Q01354	R005039	5	matn	: حَدَّثَنَا رَسُولُ اللهِ صَلَّى اللهُ عَلَيْهِ وَسَلَّمَ وَهُوَ الصَّادِقُ الْمَصْدُوقُ : إِنَّ أَحَدَكُمْ يُجْمَعُ خَلْقُهُ فِي بَطْنِ أُمِّهِ أَرْبَعِينَ يَوْمًا ، ثُمَّ يَكُونُ فِي ذَلِكَ عَلَقَةً مِثْلَ ذَلِكَ ، ثُمَّ يَكُونُ فِي ذَلِكَ مُضْغَةً مِثْلَ ذَلِكَ ، ثُمَّ يُرْسَلُ الْمَلَكُ فَيَنْفُخُ فِيهِ الرُّوحَ ، وَيُؤْمَرُ بِأَرْبَعِ كَلِمَاتٍ بِكَتْبِ رِزْقِهِ وَأَجَلِهِ وَعَمَلِهِ ، وَشَقِيٌّ أَوْ سَعِيدٌ ، فَوَالَّذِي لَا إِلَهَ غَيْرُهُ إِنَّ أَحَدَكُمْ لَيَعْمَلُ بِعَمَلِ أَهْلِ الْجَنَّةِ حَتَّى مَا يَكُونُ بَيْنَهُ وَبَيْنَهَا إِلَّا ذِرَاعٌ ، فَيَسْبِقُ عَلَيْهِ الْكِتَابُ فَيَعْمَلُ بِعَمَلِ أَهْلِ النَّارِ فَيَدْخُلُهَا ، وَإِنَّ أَحَدَكُمْ لَيَعْمَلُ بِعَمَلِ أَهْلِ النَّارِ حَتَّى مَا يَكُونُ بَيْنَهُ وَبَيْنَهَا إِلَّا ذِرَاعٌ ، فَيَسْبِقُ عَلَيْهِ الْكِتَابُ فَيَعْمَلُ بِعَمَلِ أَهْلِ الْجَنَّةِ فَيَدْخُلُهَا .	1
Q01354	R005039	6	matn	لَوْ أَنَّكُمْ كُنْتُمْ تَوَكَّلُونَ عَلَى اللَّهِ حَقَّ تَوَكُّلِهِ **لَرُزِقْتُمْ كَمَا يُرْزَقُ الطَّيْرُ**، تَغْدُو خِمَاصًا وَتَرُوحُ بِطَانًا	1
Q01354	R005039	7	matn	إنَّ رُوحَ القُدُسِ نَفَثَ في رُوعِي، **أنَّ نَفْسًا لَن تَمُوتَ حتَّى تَسْتَكْمِلَ أجَلَها، وتَسْتَوْعِبَ رِزْقَها**، فاتَّقُوا اللهَ، وأَجْمِلُوا في الطَّلَبِ، ولا يَحْمِلَنَّ أحَدَكُمُ اسْتِبْطاءُ الرِّزْقِ أنْ يَطْلُبَهُ بمَعْصِيَةِ اللهِ، فإنَّ اللهَ تعالى لا يُنالُ ما عِنْدَهُ إلَّا بِطاعَتِهِ	1
Q01354	R005039	8	matn	فيما يرويه عن ربه عز وجل أنه قال: (... يا عِبادِي، **كُلُّكُمْ جائِعٌ إلَّا مَن أطْعَمْتُهُ، فاسْتَطْعِمُونِي أُطْعِمْكُمْ**، يا عِبادِي، كُلُّكُمْ عارٍ إلَّا مَن كَسَوْتُهُ، فاسْتَكْسُونِي أكْسُكُمْ...)	1
Q04317	R005040	1	Ayah	قَالَ مَوْعِدُكُمْ يَوْمُ الزِّينَةِ وَأَن يُحْشَرَ النَّاسُ ضُحًى	1
Q04317	R005040	2	matn	صَلَاةُ الْأَوَّابِينَ حِينَ تَرْمَضُ الْفِصَالُ	1
Q04317	R005040	3	Ayah	وَالضُّحَى (1) وَاللَّيْلِ إِذَا سَجَى (2)	1
Q04317	R005040	4	Ayah	أَوَأَمِنَ أَهْلُ الْقُرَى أَن يَأْتِيَهُم بَأْسُنَا ضُحًى وَهُمْ يَلْعَبُونَ	1
Q04317	R005040	5	matn	اشْتَكَى رَسولُ اللَّهِ ﷺ فَلَمْ يَقُمْ لَيْلَتَيْنِ، أَوْ ثَلَاثًا، فَجَاءَتِ امْرَأَةٌ فَقَالَتْ: يا مُحَمَّدُ، إنِّي لَأَرْجُو أنْ يَكونَ شَيْطَانُكَ قدْ تَرَكَكَ، لَمْ أرَهُ قَرِبَكَ مُنْذُ لَيْلَتَيْنِ، أوْ ثَلَاثَةٍ، فأنْزَلَ اللَّهُ عزَّ وجلَّ: ﴿وَالضُّحَى (1) وَاللَّيْلِ إِذَا سَجَى (2) مَا وَدَّعَكَ رَبُّكَ وَمَا قَلَى (3)﴾	1
Q00015	R005041	1	Ayah	حُرِّمَتْ عَلَيْكُمُ الْمَيْتَةُ وَالدَّمُ وَلَحْمُ الْخِنْزِيرِ...	1
Q00015	R005041	2	Ayah	قُل لَّا أَجِدُ فِي مَا أُوحِيَ إِلَيَّ مُحَرَّمًا عَلَىٰ طَاعِمٍ يَطْعَمُهُ إِلَّا أَن يَكُونَ مَيْتَةً أَوْ دَمًا مَّسْفُوحًا أَوْ لَحْمَ خِنْزِيرٍ فَإِنَّهُ رِجْسٌ...	1
Q00015	R005041	3	matn	إِنَّ اللَّهَ وَرَسُولَهُ حَرَّمَ بَيْعَ الْخَمْرِ، وَالْمَيْتَةِ، وَالْخِنْزِيرِ، وَالْأَصْنَامِ	1
Q00015	R005041	4	matn	إِذَا دُبِغَ الإِهَابُ فَقَدْ طَهُرَ	1
Q05455	R005042	1	Ayah	يَا أَيُّهَا الَّذِينَ آمَنُوا أَوْفُوا بِالْعُقُودِ	1
Q05455	R005042	2	Ayah	إِنَّ اللَّهَ يَأْمُرُ بِالْعَدْلِ وَالإِحْسَانِ	1
Q05455	R005042	3	Ayah	لَا يَنْهَاكُمُ اللَّهُ عَنِ الَّذِينَ لَمْ يُقَاتِلُوكُمْ فِي الدِّينِ وَلَمْ يُخْرِجُوكُمْ مِنْ دِيَارِكُمْ أَنْ تَبَرُّوهُمْ وَتُقْسِطُوا إِلَيْهِمْ ۚ إِنَّ اللَّهَ يُحِبُّ الْمُقْسِطِينَ	1
Q05455	R005042	4	Ayah	وَتَعَاوَنُوا عَلَى الْبِرِّ وَالتَّقْوَىٰ وَلَا تَعَاوَنُوا عَلَى الْإِثْمِ وَالْعُدْوَانِ	1
Q05455	R005042	5	matn	لا طاعة في معصية الله، إنما الطاعة في المعروف	1
Q05455	R005042	6	matn	سباب المسلم فسوق، وقتاله كفر	1
Q05455	R005042	7	matn	من قتل معاهدًا لم يرح رائحة الجنة	1
Q05455	R005042	8	matn	إنما الأعمال بالنيات	0
Q01564	R005043	1	Ayah	وَلَهُنَّ مِثْلُ الَّذِي عَلَيْهِنَّ بِالْمَعْرُوفِ ۚ وَلِلرِّجَالِ عَلَيْهِنَّ دَرَجَةٌ ۗ وَاللَّهُ عَزِيزٌ حَكِيمٌ	1
Q01564	R005043	2	Ayah	وَعَاشِرُوهُنَّ بِالْمَعْرُوفِ	1
Q01564	R005043	3	Ayah	وَمِنْ آيَاتِهِ أَنْ خَلَقَ لَكُم مِّنْ أَنفُسِكُمْ أَزْوَاجًا لِّتَسْكُنُوا إِلَيْهَا وَجَعَلَ بَيْنَكُم مَّوَدَّةً وَرَحْمَةً	1
Q01564	R005043	4	matn	أَنَّ فَاطِمَةَ عَلَيْهَا السَّلَامُ شَكَتْ مَا تَلْقَى فِي يَدِهَا مِنَ الرَّحَى، فَأَتَتِ النَّبِيَّ ﷺ تَسْأَلُهُ خَادِمًا...	1
Q01564	R005043	5	matn	كُنْتُ أَنْقُلُ النَّوَى مِنْ أَرْضِ الزُّبَيْرِ الَّتِي أَقْطَعَهُ رَسُولُ اللَّهِ ﷺ عَلَى رَأْسِي...	1
Q01564	R005043	6	matn	"ما كان النبي ﷺ يصنع في بيته؟ قالت: **""كَانَ فِي مِهْنَةِ أَهْلِهِ (أي خدمة أهله)، فَإِذَا حَضَرَتِ الصَّلَاةُ قَامَ إِلَى الصَّلَاةِ""**"	1
Q05597	R005044	1	Ayah	هُوَ أَنشَأَكُم مِّنَ الْأَرْضِ وَاسْتَعْمَرَكُمْ فِيهَا	1
Q05597	R005044	2	Ayah	وَأَعِدُّوا لَهُم مَّا اسْتَطَعْتُم مِّن قُوَّةٍ	1
Q05597	R005044	3	matn	خَيْرُ النَّاسِ أَنْفَعُهُمْ لِلنَّاسِ	1
Q05597	R005044	4	Ayah	وَلَا تَبْغِ الْفَسَادَ فِي الْأَرْضِ ۖ إِنَّ اللَّهَ لَا يُحِبُّ الْمُفْسِدِينَ	1
Q05597	R005044	5	Ayah	وَلَا تُلْقُوا بِأَيْدِيكُمْ إِلَى التَّهْلُكَةِ ۛ وَأَحْسِنُوا ۛ إِنَّ اللَّهَ يُحِبُّ الْمُحْسِنِينَ	1
Q05597	R005044	6	Ayah	مَن قَتَلَ نَفْسًا بِغَيْرِ نَفْسٍ أَوْ فَسَادٍ فِي الْأَرْضِ فَكَأَنَّمَا قَتَلَ النَّاسَ جَمِيعًا	1
Q05597	R005044	7	matn	لَا ضَرَرَ وَلَا ضِرَارَ	1
Q05597	R005044	8	Ayah	وَأَحَلَّ اللَّهُ الْبَيْعَ وَحَرَّمَ الرِّبَا	1
Q05597	R005044	9	matn	نَهَى رَسُولُ اللهِ ﷺ عَنْ بَيْعِ الْحَصَاةِ، وَعَنْ بَيْعِ الْغَرَرِ	1
Q00074	R005045	1	Ayah	وَأَقِيمُوا الصَّلَاةَ وَآتُوا الزَّكَاةَ	1
Q00074	R005045	2	Ayah	إِنَّ الصَّلَاةَ كَانَتْ عَلَى الْمُؤْمِنِينَ كِتَابًا مَوْقُوتًا	1
Q00074	R005045	3	matn	بُنِيَ الإسلامُ على خمسٍ: شهادةِ أن لا إله إلا الله وأن محمدًا رسولُ الله، وإقامِ الصلاة...	1
Q00074	R005045	4	matn	جَاءَ رَجُلٌ إِلَى رَسُولِ اللهِ صَلَّى اللهُ عَلَيْهِ وَسَلَّمَ مِنْ أَهْلِ نَجْدٍ ثَائِرَ الرَّأْسِ ، يُسْمَعُ دَوِيُّ صَوْتِهِ وَلَا يُفْقَهُ مَا يَقُولُ ، حَتَّى دَنَا ، فَإِذَا هُوَ يَسْأَلُ عَنِ الْإِسْلَامِ ، فَقَالَ رَسُولُ اللهِ صَلَّى اللهُ عَلَيْهِ وَسَلَّمَ: خَمْسُ صَلَوَاتٍ فِي الْيَوْمِ وَاللَّيْلَةِ . فَقَالَ: هَلْ عَلَيَّ غَيْرُهَا؟ قَالَ: لَا ، إِلَّا أَنْ تَطَوَّعَ. قَالَ رَسُولُ اللهِ صَلَّى اللهُ عَلَيْهِ وَسَلَّمَ: وَصِيَامُ رَمَضَانَ. قَالَ: هَلْ عَلَيَّ غَيْرُهُ؟ قَالَ: لَا ، إِلَّا أَنْ تَطَوَّعَ. قَالَ: وَذَكَرَ لَهُ رَسُولُ اللهِ صَلَّى اللهُ عَلَيْهِ وَسَلَّمَ الزَّكَاةَ ، قَالَ: هَلْ عَلَيَّ غَيْرُهَا؟ قَالَ: لَا ، إِلَّا أَنْ تَطَوَّعَ. قَالَ: فَأَدْبَرَ الرَّجُلُ وَهُوَ يَقُولُ: وَاللهِ لَا أَزِيدُ عَلَى هَذَا وَلَا أَنْقُصُ. قَالَ رَسُولُ اللهِ صَلَّى اللهُ عَلَيْهِ وَسَلَّمَ: أَفْلَحَ إِنْ صَدَقَ	1
Q00074	R005045	6	matn	إنَّ بين الرجلِ وبين الشركِ والكفرِ تركَ الصلاةِ	1
Q00780	R005046	1	Ayah	إِنَّ عِدَّةَ الشُّهُورِ عِندَ اللَّهِ اثْنَا عَشَرَ شَهْرًا فِي كِتَابِ اللَّهِ يَوْمَ خَلَقَ السَّمَاوَاتِ وَالْأَرْضَ مِنْهَا أَرْبَعَةٌ حُرُمٌ ۚ ذَٰلِكَ الدِّينُ الْقَيِّمُ...	1
Q00780	R005046	2	matn	أَنَّ نَاسًا تَمَارَوْا عِنْدَهَا يَوْمَ عَرَفَةَ فِي صَوْمِ النَّبِيِّ صَلَّى اللهُ عَلَيْهِ وَسَلَّمَ، فَقَالَ بَعْضُهُمْ: هُوَ صَائِمٌ، وَقَالَ بَعْضُهُمْ: لَيْسَ بِصَائِمٍ، فَأَرْسَلَتْ إِلَيْهِ بِقَدَحِ لَبَنٍ وَهُوَ وَاقِفٌ عَلَى بَعِيرِهِ، فَشَرِبَهُ	1
Q00780	R005046	3	matn	يُكَفِّرُ السَّنَةَ المَاضِيَةَ وَالْبَاقِيَةَ	0
Q05527	R005047	1	matn	الدين النصيحة	1
Q05527	R005047	2	matn	الدين النصيحة» قلنا: لمن؟ قال: «لله ولكتابه ولرسوله ولأئمة المسلمين وعامتهم	1
Q05527	R005047	3	Ayah	قُلْ إِنَّ صَلَاتِي وَنُسُكِي وَمَحْيَايَ وَمَمَاتِي لِلَّهِ رَبِّ الْعَالَمِينَ * لَا شَرِيكَ لَهُ وَبِذَلِكَ أُمِرْتُ وَأَنَا أَوَّلُ الْمُسْلِمِينَ	1
Q05527	R005047	4	Ayah	كِتَابٌ أَنزَلْنَاهُ إِلَيْكَ مُبَارَكٌ لِّيَدَّبَّرُوا آيَاتِهِ وَلِيَتَذَكَّرَ أُولُو الْأَلْبَابِ	1
Q05527	R005047	5	Ayah	قُلْ إِن كُنتُمْ تُحِبُّونَ اللَّهَ فَاتَّبِعُونِي يُحْبِبْكُمُ اللَّهُ وَيَغْفِرْ لَكُمْ ذُنُوبَكُمْ	1
Q05527	R005047	6	matn	لا يُؤْمِنُ أحَدُكُمْ، حتَّى أكُونَ أحَبَّ إلَيْهِ مِن والِدِهِ ووَلَدِهِ والنَّاسِ أجْمَعِينَ	1
Q05527	R005047	7	Ayah	يَا أَيُّهَا الَّذِينَ آمَنُوا أَطِيعُوا اللَّهَ وَأَطِيعُوا الرَّسُولَ وَأُولِي الْأَمْرِ مِنكُمْ	1
Q05527	R005047	8	Ayah	إِنَّمَا الْمُؤْمِنُونَ إِخْوَةٌ فَأَصْلِحُوا بَيْنَ أَخَوَيْكُمْ	1
Q05527	R005047	9	Ayah	وَتَوَاصَوْا بِالْحَقِّ وَتَوَاصَوْا بِالصَّبْرِ	1
Q05527	R005047	10	matn	لا يُؤْمِنُ أحَدُكُمْ حتَّى يُحِبَّ لأخِيهِ ما يُحِبُّ لِنَفْسِهِ	1
Q05527	R005047	11	Ayah	وَأَنَا لَكُمْ نَاصِحٌ أَمِينٌ	1
Q05527	R005047	12	Ayah	وَأَنصَحُ لَكُمْ وَأَعْلَمُ مِنَ اللَّهِ مَا لَا تَعْلَمُونَ	1
Q05527	R005047	13	matn	المؤمن للمؤمن كالبنيان يشد بعضه بعضاً	1
Q05275	R005048	1	Ayah	وَلَا تَتَمَنَّوْا مَا فَضَّلَ اللَّهُ بِهِ بَعْضَكُمْ عَلَىٰ بَعْضٍ ۚ لِّلرِّجَالِ نَصِيبٌ مِّمَّا اكْتَسَبُوا ۖ وَلِلنِّسَاءِ نَصِيبٌ مِّمَّا اكْتَسَبْنَ ۚ وَاسْأَلُوا اللَّهَ مِن فَضْلِهِ ۗ إِنَّ اللَّهَ كَانَ بِكُلِّ شَيْءٍ عَلِيمًا}*	1
Q05275	R005048	2	matn	خَيْرُ نِسَائِهَا مَرْيَمُ بِنْتُ عِمْرَانَ، وَخَيْرُ نِسَائِهَا خَدِيجَةُ بِنْتُ خُوَيْلِدٍ	1
Q05275	R005048	3	Ayah	إِنَّ أَكْرَمَكُمْ عِندَ اللَّهِ أَتْقَاكُمْ ۚ إِنَّ اللَّهَ عَلِيمٌ خَبِيرٌ	1
Q05275	R005048	4	matn	لَا يَدْخُلُ الْجَنَّةَ مَنْ كَانَ فِي قَلْبِهِ مِثْقَالُ ذَرَّةٍ مِنْ كِبْرٍ	1
Q05275	R005048	5	Ayah	الرِّجَالُ قَوَّامُونَ عَلَى النِّسَاءِ بِمَا فَضَّلَ اللَّهُ بَعْضَهُمْ عَلَىٰ بَعْضٍ وَبِمَا أَنفَقُوا مِنْ أَمْوَالِهِمْ...	1
Q05275	R005048	6	Ayah	وَمِنْ آيَاتِهِ أَنْ خَلَقَ لَكُم مِّنْ أَنفُسِكُمْ أَزْوَاجًا لِّتَسْكُنُوا إِلَيْهَا وَجَعَلَ بَيْنَكُم مَّوَدَّةً وَرَحْمَةً ۚ إِنَّ فِي ذَٰلِكَ لَآيَاتٍ لِّقَوْمٍ يَتَفَكَّرُونَ	1
Q00731	R005049	1	Ayah	وَالَّذِينَ يَكْنِزُونَ الذَّهَبَ وَالْفِضَّةَ وَلَا يُنفِقُونَهَا فِي سَبِيلِ اللَّهِ فَبَشِّرْهُم بِعَذَابٍ أَلِيمٍ	1
Q00731	R005049	2	matn	أن امرأة أتت رسول الله ﷺ ومعها ابنة لها، وفي يد ابنتها **مسكتان غليظتان من ذهب**، فقال:      > **«أتعطين زكاة هذا؟»** قالت: لا. قال: **«أيسرك أن يسوِّركِ الله بهما يوم القيامة سوارين من نار؟»**      > فخلعتهما فألقتهما إلى النبي ﷺ وقالت: هما لله ولرسوله	1
Q00731	R005049	3	matn	أنها كانت تلبس أوضاحًا من ذهب، فقالت: يا رسول الله، أكنز هو؟ فقال:      > **«ما بلغ أن تؤدى زكاته فزكي فليس بكنز»	1
Q00731	R005049	4	matn	ليس في الحُلِيّ زكاة	1
Q00731	R005049	5	Ayah	خُذْ مِنْ أَمْوَالِهِمْ صَدَقَةً تُطَهِّرُهُمْ وَتُزَكِّيهِم بِهَا	1
Q00886	R005050	1	Ayah	يَا أَيُّهَا النَّاسُ اتَّقُوا رَبَّكُمُ الَّذِي خَلَقَكُم مِن نَّفْسٍ وَاحِدَةٍ	1
Q00886	R005050	2	Ayah	وَلَقَدْ كَرَّمْنَا بَنِي آدَمَ	1
Q00886	R005050	3	Ayah	إِنَّ الْمُسْلِمِينَ وَالْمُسْلِمَاتِ وَالْمُؤْمِنِينَ وَالْمُؤْمِنَاتِ وَالْقَانِتِينَ وَالْقَانِتَاتِ وَالصَّادِقِينَ وَالصَّادِقَاتِ وَالصَّابِرِينَ وَالصَّابِرَاتِ وَالْخَاشِعِينَ وَالْخَاشِعَاتِ وَالْمُتَصَدِّقِينَ وَالْمُتَصَدِّقَاتِ وَالصَّائِمِينَ وَالصَّائِمَاتِ وَالْحَافِظِينَ فُرُوجَهُمْ وَالْحَافِظَاتِ وَالذَّاكِرِينَ اللَّهَ كَثِيرًا وَالذَّاكِرَاتِ أَعَدَّ اللَّهُ لَهُمْ مَغْفِرَةً وَأَجْرًا عَظِيمًا	1
Q00886	R005050	4	Ayah	مَنْ عَمِلَ صَالِحًا مِن ذَكَرٍ أَوْ أُنثَىٰ وَهُوَ مُؤْمِنٌ فَلَنُحْيِيَنَّهُ حَيَاةً طَيِّبَةً وَلَنَجْزِيَنَّهُمْ أَجْرَهُم بِأَحْسَنِ مَا كَانُوا يَعْمَلُونَ	1
Q00886	R005050	5	Ayah	فَاسْتَجَابَ لَهُمْ رَبُّهُمْ أَنِّي لَا أُضِيعُ عَمَلَ عَامِلٍ مِّنكُم مِن ذَكَرٍ أَوْ أُنثَىٰ بَعْضُكُم مِّن بَعْضٍ	1
Q00886	R005050	6	Ayah	يَا أَيُّهَا النَّاسُ إِنَّا خَلَقْنَاكُمْ مِنْ ذَكَرٍ وَأُنْثَىٰ وَجَعَلْنَاكُمْ شُعُوبًا وَقَبَائِلَ لِتَعَارَفُوا ۚ إِنَّ أَكْرَمَكُمْ عِنْدَ اللَّهِ أَتْقَاكُمْ ۚ إِنَّ اللَّهَ عَلِيمٌ خَبِيرٌ	1
Q00886	R005050	7	matn	إنما النساء شقائق الرجال	1
Q00886	R005050	9	Ayah	وَلَيْسَ الذَّكَرُ كَالْأُنثَىٰ	1
Q00886	R005050	10	Ayah	إِنَّ أَكْرَمَكُمْ عِندَ اللَّهِ أَتْقَاكُمْ	1
Q03293	R005051	1	Ayah	فَانْكِحُوا مَا طَابَ لَكُم مِّنَ النِّسَاءِ مَثْنَىٰ وَثُلَاثَ وَرُبَاعَ ۖ فَإِنْ خِفْتُمْ أَلَّا تَعْدِلُوا فَوَاحِدَةً	1
Q03293	R005051	2	matn	مَن كَانَت لَهُ امرَأَتَانِ فَمَالَ إِلى إِحدَاهُمَا جَاءَ يَومَ القِيَامَةِ وَشِقُّهُ مَائِلٌ	1
Q03293	R005051	3	Ayah	وَلَن تَسْتَطِيعُوا أَن تَعْدِلُوا بَيْنَ النِّسَاءِ وَلَوْ حَرَصْتُمْ ۖ فَلَا تَمِيلُوا كُلَّ الْمَيْلِ فَتَذَرُوهَا كَالْمُعَلَّقَةِ	1
Q03293	R005051	4	matn	يَا مَعْشَرَ الشَّبَابِ، مَنِ اسْتَطَاعَ مِنْكُمُ البَاءَةَ فَلْيَتَزَوَّجْ، فإنَّه أغَضُّ لِلْبَصَرِ، وأَحْصَنُ لِلْفَرْجِ، ومَن لَمْ يَسْتَطِعْ فَعَلَيْهِ بالصَّوْمِ، فإنَّه له وِجَاءٌ	1
Q03293	R005051	5	Ayah	مَثْنَىٰ وَثُلَاثَ وَرُبَاعَ	1
Q03293	R005051	6	matn	أمسِكْ أربعًا وفارِقْ سائِرَهُنَّ	1
Q03293	R005051	7	Ayah	وَأَن تَجْمَعُوا بَيْنَ الْأُخْتَيْنِ إِلَّا مَا قَدْ سَلَفَ	1
Q03293	R005051	8	matn	لا يُجْمَعُ بيْنَ المَرْأَةِ وعَمَّتِها، ولا بيْنَ المَرْأَةِ وخالَتِها	1
Q02466	R005052	1	Ayah	وَأَحَلَّ اللَّهُ الْبَيْعَ وَحَرَّمَ الرِّبَا	1
Q02466	R005052	2	Ayah	يَا أَيُّهَا الَّذِينَ آمَنُوا اتَّقُوا اللَّهَ وَذَرُوا مَا بَقِيَ مِنَ الرِّبَا إِنْ كُنْتُمْ مُؤْمِنِينَ	1
Q02466	R005052	3	matn	لَعَنَ رَسُولُ اللَّهِ ﷺ آكِلَ الرِّبَا، وَمُؤْكِلَهُ، وَكَاتِبَهُ، وَشَاهِدَيْهِ، وَقَالَ: هُمْ سَوَاءٌ	1
Q02466	R005052	4	matn	اشْتَرَى رَسُولُ اللَّهِ ﷺ مِنْ يَهُودِيٍّ طَعَامًا إِلَى أَجَلٍ، وَرَهَنَهُ دِرْعًا مِنْ حَدِيدٍ	1
Q02466	R005052	5	matn	لَا تَبِعْ مَا لَيْسَ عِنْدَكَ	1
Q02199	R005053	1	matn	يُغْفَرُ لِلشَّهِيدِ كُلُّ ذَنْبٍ إلَّا الدَّيْنَ	1
Q02199	R005053	2	Ayah	فَاتَّقُوا اللَّهَ مَا اسْتَطَعْتُمْ	1
Q02199	R005053	3	Ayah	إِنَّ اللَّهَ يَأْمُرُكُمْ أَن تُؤَدُّوا الْأَمَانَاتِ إِلَىٰ أَهْلِهَا	1
Q02199	R005053	4	matn	مَنْ أَخَذَ أَمْوَالَ النَّاسِ يُرِيدُ أَدَاءَهَا أَدَّى اللَّهُ عَنْهُ، وَمَنْ أَخَذَ يُرِيدُ إِتْلَافَهَا أَتْلَفَهُ اللَّهُ	1
Q02229	R005054	1	Ayah	وَاذْكُرُوا اللَّهَ فِي أَيَّامٍ مَعْدُودَاتٍ	1
Q02229	R005054	3	matn	ما من أيام العمل الصالح فيها أحب إلى الله من هذه الأيام	0
Q02820	R005055	2	matn	الجمعة حق واجب على كل مسلم في جماعة	1
Q08247	R005056	1	Ayah	إِنَّ الصَّلَاةَ كَانَتْ عَلَى الْمُؤْمِنِينَ كِتَابًا مَّوْقُوتًا	1
Q08247	R005056	2	matn	فَإِذَا حَضَرَتِ الصَّلَاةُ فَلْيُؤَذِّنْ لَكُمْ أَحَدُكُمْ، وَلْيَؤُمَّكُمْ أَكْبَرُكُمْ	1
Q08256	R005057	1	Ayah	سَأُصْلِيهِ سَقَرَ ۝ وَمَا أَدْرَاكَ مَا سَقَرُ ۝ لَا تُبْقِي وَلَا تَذَرُ ۝ لَوَّاحَةٌ لِّلْبَشَرِ ۝ عَلَيْهَا تِسْعَةَ عَشَرَ	1
Q08256	R005057	2	Ayah	لَا تُبْقِي وَلَا تَذَرُ	1
Q08256	R005057	3	Ayah	لَوَّاحَةٌ لِّلْبَشَرِ	1
Q08256	R005057	4	Ayah	ذَرْنِي وَمَنْ خَلَقْتُ وَحِيدًا	0
Q08256	R005057	5	Ayah	سَأُصْلِيهِ سَقَرَ	1
Q08256	R005057	6	Ayah	مَا سَلَكَكُمْ فِي سَقَرَ ۝ قَالُوا لَمْ نَكُ مِنَ الْمُصَلِّينَ ۝ وَلَمْ نَكُ نُطْعِمُ الْمِسْكِينَ ۝ وَكُنَّا نَخُوضُ مَعَ الْخَائِضِينَ ۝ وَكُنَّا نُكَذِّبُ بِيَوْمِ الدِّينِ	1
Q08256	R005057	7	matn	يخرج من النار من قال لا إله إلا الله وفي قلبه وزن شعيرة من خير	0
Q06873	R005058	1	Ayah	إِنَّ اللَّهَ يَأْمُرُكُمْ أَنْ تُؤَدُّوا الْأَمَانَاتِ إِلَى أَهْلِهَا	1
Q06873	R005058	2	Ayah	يَا أَيُّهَا الَّذِينَ آمَنُوا لَا تَأْكُلُوا أَمْوَالَكُمْ بَيْنَكُمْ بِالْبَاطِلِ	1
Q06873	R005058	3	matn	لا ضرر ولا ضرار	1
Q06873	R005058	5	matn	إن الرفق لا يكون في شيء إلا زانه	0
Q07263	R005059	1	Ayah	إِلَّا تَنصُرُوهُ فَقَدْ نَصَرَهُ اللَّهُ إِذْ أَخْرَجَهُ الَّذِينَ كَفَرُوا ثَانِيَ اثْنَيْنِ إِذْ هُمَا فِي الْغَارِ	1
