question_id	Response_ID	Annotation_ID	span_type	span_text	relevance_label
Q04717	R003415	1	Ayah	وَتَعَاوَنُوا عَلَى الْبِرِّ وَالتَّقْوَى وَلاَ تَعَاوَنُوا عَلَى الإِثْمِ وَالْعُدْوَانِ	1
Q00482	R003421	1	Ayah	يَا أَيُّهَا الَّذِينَ آمَنُوا إِذَا نُودِيَ لِلصَّلَاةِ مِنْ يَوْمِ الْجُمُعَةِ فَاسْعَوْا إِلَىٰ ذِكْرِ اللَّهِ وَذَرُوا الْبَيْعَ ۚ ذَٰلِكُمْ خَيْرٌ لَكُمْ إِنْ كُنْتُمْ تَعْلَمُونَ	1
Q02845	R003432	1	Ayah	أَسْكِنُوهُنَّ مِنْ حَيْثُ سَكَنْتُمْ مِنْ وُجْدِكُمْ وَلَا تُضَارُّوهُنَّ لِتُضَيِّقُوا عَلَيْهِنَّ ۚ وَإِنْ كُنَّ أُولَاتِ حَمْلٍ فَأَنْفِقُوا عَلَيْهِنَّ حَتَّىٰ يَضَعْنَ حَمْلَهُنَّ ۚ فَإِنْ أَرْضَعْنَ لَكُمْ فَآتُوهُنَّ أُجُورَهُنَّ ۖ وَأْتَمِرُوا بَيْنَكُمْ بِمَعْرُوفٍ ۖ وَإِنْ تَعَاسَرْتُمْ فَسَتُرْضِعُ لَهُ أُخْرَىٰ	1
Q06169	R003447	1	matn	يَا أَهْلَ الْقُرْآنِ أَوْتِرُوا ، فَإِنَّ اللهَ وِتْرٌ يُحِبُّ الْوِتْرَ	0
Q04192	R003455	1	Ayah	إن الله يأمر بالعدل ، والإحسان ، وإيتاء ذي القربى ، وينهى عن الفحشاء والمنكر والبغي	1
Q06835	R003456	1	Ayah	اللَّهُ يَتَوَفَّى الْأَنفُسَ حِينَ مَوْتِهَا وَالَّتِي لَمْ تَمُتْ فِي مَنَامِهَا فَيُمْسِكُ الَّتِي قَضَى عَلَيْهَا الْمَوْتَ وَيُرْسِلُ الْأُخْرَى إِلَى أَجَلٍ مُّسَمًّى إِنَّ فِي ذَلِكَ لَآيَاتٍ لِّقَوْمٍ يَتَفَكَّرُونَ	0
Q06835	R003456	2	Ayah	ثُمَّ إِنَّكُمْ يَوْمَ الْقِيَامَةِ عِندَ رَبِّكُمْ تَخْتَصِمُونَ	0
Q06835	R003456	3	Ayah	يَا بُنَيَّ إِنَّهَا إِن تَكُ مِثْقَالَ حَبَّةٍ مِّنْ خَرْدَلٍ فَتَكُن فِي صَخْرَةٍ أَوْ فِي السَّمَاوَاتِ أَوْ فِي الْأَرْضِ يَأْتِ بِهَا اللَّهُ إِنَّ اللَّهَ لَطِيفٌ خَبِيرٌ	0
Q06835	R003456	4	matn	كلُّ سُلامى من الناس عليه صدقة كل يوم تطلع فيه الشمس، تعدل بين اثنين صدقة، وتعين الرجل في دابته فتحمله عليها أو ترفع له عليها متاعه صدقة، والكلمة الطيبة صدقة، وبكل خطوة تمشيها إلى الصلاة صدقة، وتميط الأذى عن الطريق صدقة	0
Q06835	R003456	5	matn	لَغَدْوَةٌ فِي سَبِيلِ اللهِ ، أَوْ رَوْحَةٌ خَيْرٌ مِنَ الدُّنْيَا وَمَا فِيهَا ، وَلَقَابُ قَوْسِ أَحَدِكُمْ أَوْ مَوْضِعُ يَدِهِ فِي الْجَنَّةِ خَيْرٌ مِنَ الدُّنْيَا وَمَا فِيهَا ، وَلَوْ أَنَّ امْرَأَةً مِنْ نِسَاءِ أَهْلِ الْجَنَّةِ اطَّلَعَتْ إِلَى الْأَرْضِ لَأَضَاءَتْ مَا بَيْنَهُمَا وَلَمَلَأَتْ مَا بَيْنَهُمَا رِيحًا ، وَلَنَصِيفُهَا عَلَى رَأْسِهَا خَيْرٌ مِنَ الدُّنْيَا وَمَا فِيهَا	0
Q04904	R003457	1	Ayah	وَعَاشِرُوهُنَّ بِالْمَعْرُوفِ	1
Q04904	R003457	2	matn	خيركم خيركم لأهله، وأنا خيركم لأهلي	1
Q04904	R003457	3	matn	إنما النساء شقائق الرجال	1
Q07258	R003468	1	Ayah	وَلَوْ شَاءَ رَبُّكَ لَجَعَلَ النَّاسَ أُمَّةً وَاحِدَةً ۖ وَلَا يَزَالُونَ مُخْتَلِفِينَ	1
Q07258	R003468	2	matn	إنما الأعمال بالنيات وإنما لكل امرئ ما نوى	0
Q03595	R003469	1	matn	مَنْ بَاتَ عَلَى ظَهْرِ بَيْتٍ لَيْسَ عَلَيْهِ حِجَارٌ فَقَدْ بَرِئَتْ مِنْهُ الذِّمَّةُ .	0
Q08134	R003476	1	matn	من قال: لا إله إلا الله وحده لا شريك له، له الملك، وله الحمد، وهو على كل شيء قدير في يوم مائة مرة، كانت له عدل عشر رقاب، وكتبت له مائة حسنة، ومحيت عنه مائة سيئة، وكانت له حرزًا من الشيطان يومه ذلك حتى يمسي، ولم يأت أحد بأفضل مما جاء به إلا رجل عمل أكثر من ذلك	1
Q08134	R003476	2	matn	قل: قل هو الله أحد، والمعوذتين حين تمسي وحين تصبح ثلاث مرات تكفيك من كل شيء	1
Q08134	R003476	3	matn	من قال: سبحان الله وبحمده في يوم مائة مرة، حطت خطاياه وإن كانت مثل زبد البحر	1
Q08134	R003476	4	matn	قل: قل هو الله أحد، والمعوذتين حين تمسي وحين تصبح ثلاث مرات تكفيك من كل شيء	1
Q08134	R003476	5	matn	قل: قل هو الله أحد، والمعوذتين حين تمسي وحين تصبح ثلاث مرات تكفيك من كل شيء	1
Q00043	R003478	1	matn	الْحَجُّ عَرَفَاتٌ ، الْحَجُّ عَرَفَاتٌ ، الْحَجُّ عَرَفَاتٌ ، أَيَّامُ مِنًى ثَلَاثٌ : فَمَنْ تَعَجَّلَ فِي يَوْمَيْنِ فَلا إِثْمَ عَلَيْهِ وَمَنْ تَأَخَّرَ فَلا إِثْمَ عَلَيْهِ وَمَنْ أَدْرَكَ عَرَفَةَ قَبْلَ أَنْ يَطْلُعَ الْفَجْرُ فَقَدْ أَدْرَكَ الْحَجَّ	0
Q00043	R003478	2	matn	صِيَامُ يَوْمِ عَرَفَةَ إِنِّي أَحْتَسِبُ عَلَى اللهِ أَنْ يُكَفِّرَ السَّنَةَ الَّتِي قَبْلَهُ وَالسَّنَةَ الَّتِي بَعْدَهُ	1
Q07707	R003485	1	Ayah	لا يكلف الله نفسًا إلا وسعها	0
Q07707	R003485	2	matn	طَلَبُ الْعِلْمِ فَرِيضَةٌ عَلَى كُلِّ مُسْلِمٍ ، وَوَاضِعُ الْعِلْمِ عِنْدَ غَيْرِ أَهْلِهِ كَمُقَلِّدِ الْخَنَازِيرِ الْجَوْهَرَ وَاللُّؤْلُؤَ وَالذَّهَبَ	1
Q07447	R003497	1	Ayah	ولمن خاف مقام ربه جنتان	0
Q07447	R003497	2	Ayah	إِنَّ الَّذِينَ كَفَرُوا بِآيَاتِنَا سَوْفَ نُصْلِيهِمْ نَارًا كُلَّمَا نَضِجَتْ جُلُودُهُمْ بَدَّلْنَاهُمْ جُلُودًا غَيْرَهَا لِيَذُوقُوا الْعَذَابَ ۗ إِنَّ اللَّهَ كَانَ عَزِيزًا حَكِيمًا	1
Q07447	R003497	3	matn	ثَلَاثَةٌ لَا يُكَلِّمُهُمُ اللهُ عَزَّ وَجَلَّ يَوْمَ الْقِيَامَةِ وَلَا يَنْظُرُ إِلَيْهِمْ وَلَا يُزَكِّيهِمْ وَلَهُمْ عَذَابٌ أَلِيمٌ : الْمَنَّانُ بِمَا أَعْطَى ، وَالْمُسْبِلُ إِزَارَهُ ، وَالْمُنَفِّقُ سِلْعَتَهُ بِالْحَلِفِ الْكَاذِبِ	0
Q07447	R003497	5	Ayah	وَمَنْ أَحْسَنُ مِنَ اللَّهِ حُكْمًا لِقَوْمٍ يُوقِنُونَ	1
Q05526	R003502	2	Ayah	يريد الله بكم اليسر ولا يريد بكم العسر	0
Q05526	R003502	3	Ayah	هُوَ الَّذِي جَعَلَ لَكُمُ اللَّيْلَ لِتَسْكُنُوا فِيهِ وَالنَّهَارَ مُبْصِرًا ۚ إِنَّ فِي ذَٰلِكَ لَآيَاتٍ لِقَوْمٍ يَسْمَعُونَ	0
Q05526	R003502	4	matn	لا ضرر ولا ضرار	0
Q05526	R003502	5	matn	يسروا ولا تعسروا	0
Q05526	R003502	6	matn	لَا تَكُونُوا إِمَّعَةً ؛ تَقُولُونَ إِنْ أَحْسَنَ النَّاسُ أَحْسَنَّا وَإِنْ ظَلَمُوا ظَلَمْنَا ، وَلَكِنْ وَطِّنُوا أَنْفُسَكُمْ؛ إِنْ أَحْسَنَ النَّاسُ أَنْ تُحْسِنُوا وَإِنْ أَسَاءُوا فَلَا تَظْلِمُوا	0
Q08140	R003517	2	Ayah	فَإِنْ تَابُوا وَأَقَامُوا الصَّلَاةَ وَآتَوُا الزَّكَاةَ فَخَلُّوا سَبِيلَهُمْ	1
Q08140	R003517	3	matn	والله لو منعوني عقالًا كانوا يؤدونه إلى رسول الله صلى الله عليه وسلم لقاتلتهم عليه	1
Q08140	R003517	4	matn	والله لأقاتلن من فرق بين الصلاة والزكاة، فإن الزكاة حق المال، والله لو منعوني عناقًا كانوا يؤدونه إلى رسول الله صلى الله عليه وسلم لقاتلتهم على منعها	1
Q08140	R003517	5	matn	والله لو منعوني عقالًا كانوا يؤدونه إلى رسول الله صلى الله عليه وسلم لقاتلتهم عليه	1
Q04574	R003530	1	matn	مَن قرأ سورةَ الكهفِ في يومِ الجمعةِ أضاءَ له من النورِ ما بينَ الجمعتينِ	1
Q04574	R003530	2	matn	مَن قرأ سورةَ الكهفِ في يومِ الجمعةِ أضاءَ له من النورِ ما بينَ الجمعتينِ	1
Q01773	R003537	1	Ayah	ولا تلقوا بأيديكم إلى التهلكة	1
Q01773	R003537	2	matn	لا ضرر ولا ضرار	1
Q00262	R003538	1	matn	الْحَجُّ عَرَفَاتٌ ، الْحَجُّ عَرَفَاتٌ ، الْحَجُّ عَرَفَاتٌ ، أَيَّامُ مِنًى ثَلَاثٌ : فَمَنْ تَعَجَّلَ فِي يَوْمَيْنِ فَلا إِثْمَ عَلَيْهِ وَمَنْ تَأَخَّرَ فَلا إِثْمَ عَلَيْهِ وَمَنْ أَدْرَكَ عَرَفَةَ قَبْلَ أَنْ يَطْلُعَ الْفَجْرُ فَقَدْ أَدْرَكَ الْحَجَّ	0
Q00262	R003538	2	matn	دَخَلَ عُثْمَانُ بْنُ عَفَّانَ الْمَسْجِدَ بَعْدَ صَلَاةِ الْمَغْرِبِ فَقَعَدَ وَحْدَهُ فَقَعَدْتُ إِلَيْهِ ، فَقَالَ : يَا ابْنَ أَخِي ، سَمِعْتُ رَسُولَ اللهِ صَلَّى اللهُ عَلَيْهِ وَسَلَّمَ يَقُولُ : مَنْ صَلَّى الْعِشَاءَ فِي جَمَاعَةٍ فَكَأَنَّمَا قَامَ نِصْفَ اللَّيْلِ ، وَمَنْ صَلَّى الصُّبْحَ فِي جَمَاعَةٍ فَكَأَنَّمَا صَلَّى اللَّيْلَ كُلَّهُ	0
Q01281	R003550	2	matn	إن الله وملائكته يصلون على الصفوف الأول	1
Q01281	R003550	3	Ayah	إِنَّ الَّذِينَ يَتْلُونَ كِتَابَ اللَّهِ وَأَقَامُوا الصَّلَاةَ وَأَنفَقُوا مِمَّا رَزَقْنَاهُمْ سِرًّا وَعَلَانِيَةً يَرْجُونَ تِجَارَةً لَّن تَبُورَ	0
Q02623	R003555	1	Ayah	وَهُوَ الَّذِي أَنْزَلَ مِنَ السَّمَاءِ مَاءً فَأَخْرَجْنَا بِهِ نَبَاتَ كُلِّ شَيْءٍ فَأَخْرَجْنَا مِنْهُ خَضِرًا نُخْرِجُ مِنْهُ حَبًّا مُتَرَاكِبًا وَمِنَ النَّخْلِ مِنْ طَلْعِهَا قِنْوَانٌ دَانِيَةٌ وَجَنَّاتٍ مِنْ أَعْنَابٍ وَالزَّيْتُونَ وَالرُّمَّانَ مُشْتَبِهًا وَغَيْرَ مُتَشَابِهٍ ۗ انْظُرُوا إِلَىٰ ثَمَرِهِ إِذَا أَثْمَرَ وَيَنْعِهِ ۚ إِنَّ فِي ذَٰلِكُمْ لَآيَاتٍ لِقَوْمٍ يُؤْمِنُونَ	0
Q02623	R003555	2	Ayah	هُوَ الَّذِي جَعَلَ لَكُمُ اللَّيْلَ لِتَسْكُنُوا فِيهِ وَالنَّهَارَ مُبْصِرًا ۚ إِنَّ فِي ذَٰلِكَ لَآيَاتٍ لِقَوْمٍ يَسْمَعُونَ	0
Q02623	R003555	3	Ayah	هُوَ الَّذِي جَعَلَ لَكُمُ اللَّيْلَ لِتَسْكُنُوا فِيهِ وَالنَّهَارَ مُبْصِرًا ۚ إِنَّ فِي ذَٰلِكَ لَآيَاتٍ لِقَوْمٍ يَسْمَعُونَ	0
Q03462	R003556	1	matn	لَبَّيْكَ اللَّهُمَّ لَبَّيْكَ ، لَبَّيْكَ لَا شَرِيكَ لَكَ لَبَّيْكَ ، إِنَّ الْحَمْدَ وَالنِّعْمَةَ لَكَ وَالْمُلْكَ ، لَا شَرِيكَ لَكَ	1
Q00380	R003558	1	Ayah	ولأبويه لكل واحد منهما السدس مما ترك إن كان له ولد	1
Q04040	R003573	1	matn	إنما الأعمال بالنيات، وإنما لكل امرئ ما نوى	0
Q04284	R003587	1	Ayah	قُل لِلْمُؤْمِنِينَ يَغُضُّوا مِنْ أَبْصَارِهِمْ وَيَحْفَظُوا فُرُوجَهُمْ ذَلِكَ أَزْكَى لَهُمْ إِنَّ اللَّهَ خَبِيرٌ بِمَا يَصْنَعُونَ	1
Q04284	R003587	2	matn	ما تركت بعدي فتنة هي أضر على الرجال من النساء	1
Q06188	R003594	1	matn	قُلْتُ : يَا رَسُولَ اللهِ ، أَيُّ الْأَعْمَالِ أَفْضَلُ ؟ قَالَ : الْإِيمَانُ بِاللهِ ، وَالْجِهَادُ فِي سَبِيلِهِ ، قَالَ : قُلْتُ : أَيُّ الرِّقَابِ أَفْضَلُ ؟ قَالَ : أَنْفَسُهَا عِنْدَ أَهْلِهَا ، وَأَكْثَرُهَا ثَمَنًا ، قَالَ : قُلْتُ : فَإِنْ لَمْ أَفْعَلْ ؟ قَالَ : تُعِينُ صَانِعًا ، أَوْ تَصْنَعُ لِأَخْرَقَ ، قَالَ : قُلْتُ : يَا رَسُولَ اللهِ ، أَرَأَيْتَ إِنْ ضَعُفْتُ عَنْ بَعْضِ الْعَمَلِ ؟ قَالَ : تَكُفُّ شَرَّكَ عَنِ النَّاسِ ، فَإِنَّهَا صَدَقَةٌ مِنْكَ عَلَى نَفْسِكَ .	0
Q02329	R003606	1	Ayah	ولا تبرجن تبرج الجاهلية الأولى	0
Q02329	R003606	2	matn	لأن يهدي الله بك رجلا واحدا خير لك من حمر النعم	0
Q02329	R003606	3	matn	إن من أشر الناس منزلة عند الله يوم القيامة الرجل يفضي إلى امرأته وتفضي إليه ثم ينشر سرها	0
Q06093	R003609	1	Ayah	قالت الأعراب آمنا قل لم تؤمنوا ولكن قولوا أسلمنا ولما يدخل الإيمان في قلوبكم وإن تطيعوا الله ورسوله لا يلتكم من أعمالكم شيئا إن الله غفور رحيم	1
Q02110	R003610	2	matn	يَسِّرُوا وَلَا تُعَسِّرُوا ، وَبَشِّرُوا وَلَا تُنَفِّرُوا	1
Q07157	R003620	1	Ayah	وَقُلِ الْحَقُّ مِنْ رَبِّكُمْ فَمَنْ شَاءَ فَلْيُؤْمِنْ وَمَنْ شَاءَ فَلْيَكْفُرْ	1
Q07777	R003633	1	Ayah	الطلاق مرتان فإمساك بمعروف أو تسريح بإحسان	1
Q07777	R003633	2	matn	إنما الطلاق لمن أخذ بالساق	1
Q01291	R003639	1	Ayah	شَهْرُ رَمَضَانَ الَّذِي أُنْزِلَ فِيهِ الْقُرْآنُ هُدًى لِلنَّاسِ وَبَيِّنَاتٍ مِنَ الْهُدَىٰ وَالْفُرْقَانِ ۚ فَمَنْ شَهِدَ مِنْكُمُ الشَّهْرَ فَلْيَصُمْهُ ۖ وَمَنْ كَانَ مَرِيضًا أَوْ عَلَىٰ سَفَرٍ فَعِدَّةٌ مِنْ أَيَّامٍ أُخَرَ ۗ يُرِيدُ اللَّهُ بِكُمُ الْيُسْرَ وَلَا يُرِيدُ بِكُمُ الْعُسْرَ وَلِتُكْمِلُوا الْعِدَّةَ وَلِتُكَبِّرُوا اللَّهَ عَلَىٰ مَا هَدَاكُمْ وَلَعَلَّكُمْ تَشْكُرُونَ	1
Q06682	R003649	1	matn	إِذَا أَتَاكُمْ مَنْ تَرْضَوْنَ خُلُقَهُ وَدِينَهُ فَزَوِّجُوهُ ، إِلَّا تَفْعَلُوهُ تَكُنْ فِتْنَةٌ فِي الْأَرْضِ وَفَسَادٌ عَرِيضٌ .	1
Q05982	R003658	1	matn	لَأَنْ يَأْخُذَ أَحَدُكُمْ أَحْبُلَهُ فَيَأْتِيَ الْجَبَلَ ، فَيَجِيءَ بِحُزْمَةِ حَطَبٍ عَلَى ظَهْرِهِ ، فَيَبِيعَهَا فَيَسْتَغْنِيَ بِثَمَنِهَا ، خَيْرٌ لَهُ مِنْ أَنْ يَسْأَلَ النَّاسَ أَعْطَوْهُ أَوْ مَنَعُوهُ	0
Q06169	R003660	1	Ayah	إِذْ قَالَ رَبُّكَ لِلْمَلَائِكَةِ إِنِّي خَالِقٌ بَشَرًا مِنْ طِينٍ	0
Q06169	R003660	2	Ayah	يَسْأَلُونَكَ عَنِ السَّاعَةِ أَيَّانَ مُرْسَاهَا	0
Q02501	R003662	1	matn	لَا يَحِلُّ دَمُ امْرِئٍ مُسْلِمٍ يَشْهَدُ أَنْ لَا إِلَهَ إِلَّا اللهُ وَأَنِّي رَسُولُ اللهِ إِلَّا بِإِحْدَى ثَلَاثٍ ؛ الثَّيِّبُ الزَّانِي ، وَالنَّفْسُ بِالنَّفْسِ ، وَالتَّارِكُ لِدِينِهِ الْمُفَارِقُ لِلْجَمَاعَةِ	0
Q01627	R003665	2	matn	خَطَبَنَا رَسُولُ اللهِ صَلَّى اللهُ عَلَيْهِ وَسَلَّمَ فَقَالَ : أَيُّهَا النَّاسُ ، قَدْ فَرَضَ اللهُ عَلَيْكُمُ الْحَجَّ فَحُجُّوا ، فَقَالَ رَجُلٌ : أَكُلَّ عَامٍ يَا رَسُولَ اللهِ ؟ فَسَكَتَ ، حَتَّى قَالَهَا ثَلَاثًا ، فَقَالَ رَسُولُ اللهِ صَلَّى اللهُ عَلَيْهِ وَسَلَّمَ : لَوْ قُلْتُ : نَعَمْ ، لَوَجَبَتْ ، وَلَمَا اسْتَطَعْتُمْ ، ثُمَّ قَالَ : ذَرُونِي مَا تَرَكْتُكُمْ ، فَإِنَّمَا هَلَكَ مَنْ كَانَ قَبْلَكُمْ بِكَثْرَةِ سُؤَالِهِمْ ، وَاخْتِلَافِهِمْ عَلَى أَنْبِيَائِهِمْ ، فَإِذَا أَمَرْتُكُمْ بِشَيْءٍ فَأْتُوا مِنْهُ مَا اسْتَطَعْتُمْ ، وَإِذَا نَهَيْتُكُمْ عَنْ شَيْءٍ فَدَعُوهُ	0
Q01627	R003665	3	matn	ضَحَّى النَّبِيُّ صَلَّى اللهُ عَلَيْهِ وَسَلَّمَ بِكَبْشَيْنِ أَمْلَحَيْنِ أَقْرَنَيْنِ ذَبَحَهُمَا بِيَدِهِ وَسَمَّى وَكَبَّرَ وَوَضَعَ رِجْلَهُ عَلَى صِفَاحِهِمَا .	1
Q08006	R003669	1	Ayah	وَلَا تَجْعَلْ يَدَكَ مَغْلُولَةً إِلَى عُنُقِكَ وَلَا تَبْسُطْهَا كُلَّ الْبَسْطِ فَتَقْعُدَ مَلُومًا مَّحْسُورًا	1
Q08006	R003669	2	Ayah	وَالَّذِينَ إِذَا أَنْفَقُوا لَمْ يُسْرِفُوا وَلَمْ يَقْتُرُوا وَكَانَ بَيْنَ ذَلِكَ قَوَامًا	1
Q08006	R003669	4	matn	ما نقصت صدقة من مال، وما زاد الله عبدا بعفو إلا عزاً، وما تواضع أحد لله إلا رفعه	1
Q08006	R003669	5	Ayah	إِنَّ الْمُبَذِّرِينَ كَانُوا إِخْوَانَ الشَّيَاطِينِ وَكَانَ الشَّيْطَانُ لِرَبِّهِ كَفُورًا	1
Q01095	R003670	1	Ayah	وَلَا تَنْقُضُوا الْأَيْمَانَ بَعْدَ تَوْكِيدِهَا وَقَدْ جَعَلْتُمُ اللَّهَ عَلَيْكُمْ كَفِيلًا إِنَّ اللَّهَ يَعْلَمُ مَا تَفْعَلُونَ	1
Q01095	R003670	2	matn	من نذر أن يطيع الله فليطعه، ومن نذر أن يعصي الله فلا يعصه	1
Q01095	R003670	3	matn	إن الله تعالى قال: أنا عند ظن عبدي بي، وأنا معه إذا ذكرني، فإن ذكرني في نفسه ذكرته في نفسي، وإن ذكرني في ملأ ذكرته في ملأ خير منهم	0
Q02223	R003672	1	matn	لَمْ يَكُنْ رَسُولُ اللهِ صَلَّى اللهُ عَلَيْهِ وَسَلَّمَ يَدَعُ هَؤُلَاءِ الدَّعَوَاتِ حِينَ يُمْسِي وَحِينَ يُصْبِحُ : اللَّهُمَّ إِنِّي أَسْأَلُكَ الْعَافِيَةَ فِي الدُّنْيَا وَالْآخِرَةِ ، اللَّهُمَّ إِنِّي أَسْأَلُكَ الْعَفْوَ وَالْعَافِيَةَ فِي دِينِي وَدُنْيَايَ وَأَهْلِي وَمَالِي ، اللَّهُمَّ اسْتُرْ عَوْرَتِي وَقَالَ عُثْمَانُ : عَوْرَاتِي وَآمِنْ رَوْعَاتِي ، اللَّهُمَّ احْفَظْنِي مِنْ بَيْنِ يَدَيَّ وَمِنْ خَلْفِي ، وَعَنْ يَمِينِي وَعَنْ شِمَالِي ، وَمِنْ فَوْقِي ، وَأَعُوذُ بِعَظَمَتِكَ أَنْ أُغْتَالَ مِنْ تَحْتِي	1
Q02223	R003672	4	Ayah	فَإِذَا قَرَأْتَ الْقُرْآنَ فَاسْتَعِذْ بِاللَّهِ مِنَ الشَّيْطَانِ الرَّجِيمِ	0
Q05478	R003678	1	matn	أكمل المؤمنين إيمانا أحسنهم خُلُقًا، وخياركم خياركم لنسائهم	0
Q02172	R003685	2	matn	سئل رسول الله صلى الله عليه وسلم عن صلاة الليل، فقال: صلاة الليل مثنى مثنى، فإذا خشي أحدكم الصبح صلى ركعة واحدة توتر له ما قد صلى	1
Q02172	R003685	3	matn	أفضل الصلاة بعد الفريضة صلاة الليل	0
Q03215	R003686	1	Ayah	هُوَ الْأَوَّلُ وَالْآخِرُ وَالظَّاهِرُ وَالْبَاطِنُ وَهُوَ بِكُلِّ شَيْءٍ عَلِيمٌ	1
Q03215	R003686	2	Ayah	قُلْ هُوَ اللَّهُ أَحَدٌ (1) اللَّهُ الصَّمَدُ (2) لَمْ يَلِدْ وَلَمْ يُولَدْ (3) وَلَمْ يَكُن لَّهُ كُفُوًا أَحَدٌ (4)	1
Q03215	R003686	3	Ayah	وَلَمْ يَكُنْ لَهُ كُفُوًا أَحَدٌ	1
Q03215	R003686	4	matn	إِذَا قَاتَلَ أَحَدُكُمْ أَخَاهُ فَلْيَجْتَنِبِ الْوَجْهَ فَإِنَّ اللهَ خَلَقَ آدَمَ عَلَى صُورَتِهِ .	0
Q03215	R003686	5	matn	كان الله ولم يكن شيء	1
Q02623	R003693	1	Ayah	وما أرسلناك إلا رحمة للعالمين	0
Q03514	R003701	1	Ayah	أَيْنَمَا تَكُونُوا يُدْرِكْكُمُ الْمَوْتُ وَلَوْ كُنْتُمْ فِي بُرُوجٍ مُشَيَّدَةٍ ۗ وَإِنْ تُصِبْهُمْ حَسَنَةٌ يَقُولُوا هَـٰذِهِ مِنْ عِنْدِ اللَّهِ ۖ وَإِنْ تُصِبْهُمْ سَيِّئَةٌ يَقُولُوا هَـٰذِهِ مِنْ عِنْدِكَ ۚ قُلْ كُلٌّ مِنْ عِنْدِ اللَّهِ ۖ فَمَالِ هَـٰؤُلَاءِ الْقَوْمِ لَا يَكَادُونَ يَفْقَهُونَ حَدِيثًا	1
Q03514	R003701	2	Ayah	مَا أَصَابَكَ مِنْ حَسَنَةٍ فَمِنَ اللَّهِ ۖ وَمَا أَصَابَكَ مِنْ سَيِّئَةٍ فَمِنْ نَفْسِكَ ۚ وَأَرْسَلْنَاكَ لِلنَّاسِ رَسُولًا ۚ وَكَفَىٰ بِاللَّهِ شَهِيدًا	1
Q02586	R003704	1	matn	أَنَّ رَسُولَ اللهِ صَلَّى اللهُ عَلَيْهِ وَسَلَّمَ لَعَنَ آكِلَ الرِّبَا وَمُوكِلَهُ وَشَاهِدَيْهِ وَكَاتِبَهُ	0
Q08271	R003711	1	Ayah	وَلَا تُنكِحُوا الْمُشْرِكِينَ حَتَّى يُؤْمِنُوا وَلَعَبْدٌ مُؤْمِنٌ خَيْرٌ مِنْ مُشْرِكٍ وَلَوْ أَعْجَبَكُمْ	1
Q08271	R003711	2	matn	لا يَفْرَكْ مُؤْمِنٌ مُؤْمِنَةً، إنْ كَرِهَ مِنْهَا خُلُقًا رَضِيَ مِنْهَا آخَرَ	0
Q01841	R003715	1	Ayah	قُلْ لِلْمُؤْمِنِينَ يَغُضُّوا مِنْ أَبْصَارِهِمْ وَيَحْفَظُوا فُرُوجَهُمْ ۚ ذَٰلِكَ أَزْكَىٰ لَهُمْ ۗ إِنَّ اللَّهَ خَبِيرٌ بِمَا يَصْنَعُونَ	1
Q05903	R003716	1	Ayah	فانكحوا ما طاب لكم من النساء مثنى وثلاث ورباع	1
Q07898	R003723	2	matn	إنما بعثت لأتمم صالح الأخلاق	1
Q05844	R003727	1	Ayah	وَمَنْ يَبْتَغِ غَيْرَ الْإِسْلَامِ دِينًا فَلَنْ يُقْبَلَ مِنْهُ وَهُوَ فِي الْآخِرَةِ مِنَ الْخَاسِرِينَ	1
