question_id	Response_ID	Annotation_ID	span_type	span_text	relevance_label
Q01126	R005366	1	Ayah	فَمَن كَانَ مِنكُم مَّرِيضًا أَوْ عَلَىٰ سَفَرٍ فَعِدَّةٌ مِّنْ أَيَّامٍ أُخَرَ	1
Q01126	R005366	2	matn	كَانَ يُصِيبُنَا ذَلِكَ، فَنُؤْمَرُ بِقَضَاءِ الصَّوْمِ، وَلَا نُؤْمَرُ بِقَضَاءِ الصَّلَاةِ	1
Q01126	R005366	3	matn	كَانَ يَكُونُ عَلَيَّ الصَّوْمُ مِنْ رَمَضَانَ، فَمَا أَسْتَطِيعُ أَنْ أَقْضِيَهُ إِلَّا فِي شَعْبَانَ...	1
Q05074	R005367	1	Ayah	وَتَعَاوَنُوا عَلَى الْبِرِّ وَالتَّقْوَىٰ ۖ وَلَا تَعَاوَنُوا عَلَى الْإِثْمِ وَالْعُدْوَانِ ۚ وَاتَّقُوا اللَّهَ ۖ إِنَّ اللَّهَ شَدِيدُ الْعِقَابِ	1
Q05074	R005367	2	Ayah	يَا أَيُّهَا الَّذِينَ آمَنُوا إِنَّمَا الْخَمْرُ وَالْمَيْسِرُ وَالْأَنصَابُ وَالْأَزْلَامُ رِجْسٌ مِّنْ عَمَلِ الشَّيْطَانِ فَاجْتَنِبُوهُ لَعَلَّكُمْ تُفْلِحُونَ	1
Q05074	R005367	3	matn	لَعَنَ رَسُولُ اللَّهِ ﷺ فِي الْخَمْرِ عَشَرَةً: عَاصِرَهَا، وَمُعْتَصِرَهَا، وَشَارِبَهَا، وَحَامِلَهَا، وَالْمَحْمُولَةَ إِلَيْهِ، وَسَاقِيَهَا، وَبَائِعَهَا، وَآكِلَ ثَمَنِهَا، وَالْمُشْتَرِيَ لَهَا، وَالْمُشْتَرَاةَ لَهُ	1
Q05074	R005367	4	matn	مَنْ كَانَ يُؤْمِنُ بِاللَّهِ وَالْيَوْمِ الآخِرِ فَلا يَجْلِسْ عَلَى مَائِدَةٍ يُدَارُ عَلَيْهَا بِالْخَمْرِ	1
Q05329	R005368	1	matn	لا تَبْدَؤُوا اليَهُودَ ولا النَّصارى بالسَّلامِ...	1
Q05329	R005368	2	matn	إذا سَلَّمَ علَيْكُم أهْلُ الكِتابِ فَقُولوا: وعَلَيْكُم	1
Q05329	R005368	3	Ayah	وَإِذَا حُيِّيتُم بِتَحِيَّةٍ فَحَيُّوا بِأَحْسَنَ مِنْهَا أَوْ رُدُّوهَا ۗ إِنَّ اللَّهَ كَانَ عَلَىٰ كُلِّ شَيْءٍ حَسِيبًا	1
Q05329	R005368	4	Ayah	لَّا يَنْهَاكُمُ اللَّهُ عَنِ الَّذِينَ لَمْ يُقَاتِلُوكُمْ فِي الدِّينِ وَلَمْ يُخْرِجُوكُم مِّن دِيَارِكُمْ أَن تَبَرُّوهُمْ وَتُقْسِطُوا إِلَيْهِمْ ۚ إِنَّ اللَّهَ يُحِبُّ الْمُقْسِطِينَ	1
Q05329	R005368	5	Ayah	وَقُولُوا لِلنَّاسِ حُسْنًا	1
Q07002	R005369	3	matn	كانَ إذَا قَعَدَ في الصَّلَاةِ، جَعَلَ قَدَمَهُ اليُسْرَى بيْنَ فَخِذِهِ وسَاقِهِ، وفَرَشَ قَدَمَهُ اليُمْنَى، ووَضَعَ يَدَهُ اليُسْرَى علَى رُكْبَتِهِ اليُسْرَى، ووَضَعَ يَدَهُ اليُمْنَى علَى فَخِذِهِ اليُمْنَى، وأَشَارَ بإصْبَعِهِ	1
Q07002	R005369	4	matn	وقَبضَ اثنتَينِ وحلَّقَ حَلقةً وأشارَ بالسَّبَّابةِ	1
Q07002	R005369	6	matn	كانَ يُشِيرُ بإصْبَعِهِ إذَا دَعَا، ولَا يُحَرِّكُهَا	1
Q07002	R005369	7	matn	لهِيَ أشدُّ على الشَّيطانِ منَ الحديدِ	0
Q04650	R005370	1	Ayah	أَلَا لَهُ الْخَلْقُ وَالْأَمْرُ ۗ تَبَارَكَ اللَّهُ رَبُّ الْعَالَمِينَ	1
Q04650	R005370	2	Ayah	وَلَئِن سَأَلْتَهُم مَّنْ خَلَقَ السَّمَاوَاتِ وَالْأَرْضَ لَيَقُولُنَّ اللَّهُ	1
Q04650	R005370	3	Ayah	وَاعْبُدُوا اللَّهَ وَلَا تُشْرِكُوا بِهِ شَيْئًا	1
Q04650	R005370	4	Ayah	إِيَّاكَ نَعْبُدُ وَإِيَّاكَ نَسْتَعِينُ	1
Q04650	R005370	5	matn	يا مُعاذُ، هلْ تَدْرِي حَقَّ اللَّهِ علَى عِبَادِهِ، وما حَقُّ العِبَادِ علَى اللَّهِ؟»**، قلتُ: اللَّهُ ورَسولُهُ أعْلَمُ، قالَ: **«فإنَّ حَقَّ اللَّهِ علَى العِبَادِ أنْ يَعْبُدُوهُ ولَا يُشْرِكُوا به شيئًا، وحَقَّ العِبَادِ علَى اللَّهِ أنْ لا يُعَذِّبَ مَن لا يُشْرِكُ به شيئًا	1
Q04524	R005371	1	Ayah	يَا أَيُّهَا النَّاسُ إِنَّا خَلَقْنَاكُم مِّن ذَكَرٍ وَأُنثَىٰ وَجَعَلْنَاكُمْ شُعُوبًا وَقَبَائِلَ لِتَعَارَفُوا	1
Q04524	R005371	2	Ayah	وَأَنَّهُ خَلَقَ الزَّوْجَيْنِ الذَّكَرَ وَالْأُنثَىٰ * مِن نُّطْفَةٍ إِذَا تُمْنَىٰ	1
Q04524	R005371	3	matn	تَزَوَّجُوا الْوَدُودَ الْوَلُودَ إِنِّي مُكَاثِرٌ بِكُمُ الأَنْبِيَاءَ يَوْمَ الْقِيَامَةِ	1
Q04524	R005371	4	Ayah	وَلَأُضِلَّنَّهُمْ وَلَأُمَنِّيَنَّهُمْ وَلَآمُرَنَّهُمْ فَلَيُبَتِّكُنَّ آذَانَ الْأَنْعَامِ وَلَآمُرَنَّهُمْ فَلَيُغَيِّرُنَّ خَلْقَ اللَّهِ ۚ وَمَن يَتَّخِذِ الشَّيْطَانَ وَلِيًّا مِّن دُونِ اللَّهِ فَقَدْ خَسِرَ خُسْرَانًا مُّبِينًا	1
Q04524	R005371	5	matn	مَنِ ادَّعَى إِلَى غَيْرِ أَبِيهِ، وَهُوَ يَعْلَمُ أَنَّهُ غَيْرُ أَبِيهِ، فَالْجَنَّةُ عَلَيْهِ حَرَامٌ	1
Q04524	R005371	6	Ayah	وَلَقَدْ كَرَّمْنَا بَنِي آدَمَ وَحَمَلْنَاهُمْ فِي الْبَرِّ وَالْبَحْرِ...	1
Q04524	R005371	7	matn	مَا أَنْزَلَ اللَّهُ دَاءً إِلَّا أَنْزَلَ لَهُ شِفَاءً	1
Q04524	R005371	8	matn	تَدَاوَوْا عِبَادَ اللَّهِ، فَإِنَّ اللَّهَ سُبْحَانَهُ لَمْ يَضَعْ دَاءً إِلاَّ وَضَعَ مَعَهُ شِفَاءً...	1
Q04524	R005371	9	Ayah	...وَمَنْ أَحْيَاهَا فَكَأَنَّمَا أَحْيَا النَّاسَ جَمِيعًا...	1
Q04524	R005371	10	matn	لاَ ضَرَرَ وَلاَ ضِرَارَ	1
Q06590	R005372	3	matn	مَا مَلَأَ آدَمِيٌّ وِعَاءً شَرًّا مِنْ بَطْنٍ ، بِحَسْبِ ابْنِ آدَمَ أُكُلاَتٌ يُقِمْنَ صُلْبَهُ ، فَإِنْ كَانَ لَا مَحَالَةَ فَثُلُثٌ لِطَعَامِهِ وَثُلُثٌ لِشَرَابِهِ وَثُلُثٌ لِنَفَسِهِ .	1
Q01095	R005373	1	Ayah	يُوفُونَ بِالنَّذْرِ	1
Q01095	R005373	2	Ayah	ثُمَّ لْيَقْضُوا تَفَثَهُمْ وَلْيُوفُوا نُذُورَهُمْ	1
Q01095	R005373	3	matn	مَن نذر أن يُطيع الله فليُطِعه، ومن نذر أن يعصيه فلا يعصه	1
Q08058	R005374	1	Ayah	وَمَا أَرْسَلْنَا مِنْ قَبْلِكَ مِنْ رَسُولٍ إِلَّا نُوحِي إِلَيْهِ أَنَّهُ لَا إِلَٰهَ إِلَّا أَنَا فَاعْبُدُونِ	1
Q08058	R005374	2	Ayah	كَانَ النَّاسُ أُمَّةً وَاحِدَةً فَبَعَثَ اللَّهُ النَّبِيِّينَ مُبَشِّرِينَ وَمُنذِرِينَ وَأَنْزَلَ مَعَهُمُ الْكِتَابَ بِالْحَقِّ لِيَحْكُمَ بَيْنَ النَّاسِ فِيمَا اخْتَلَفُوا فِيهِ	1
Q08058	R005374	3	Ayah	رُسُلًا مُبَشِّرِينَ وَمُنذِرِينَ لِئَلَّا يَكُونَ لِلنَّاسِ عَلَى اللَّهِ حُجَّةٌ بَعْدَ الرُّسُلِ	1
Q08058	R005374	4	Ayah	وَمَا نُرْسِلُ الْمُرْسَلِينَ إِلَّا مُبَشِّرِينَ وَمُنذِرِينَ	1
Q08058	R005374	5	Ayah	كِتَابٌ أَنْزَلْنَاهُ إِلَيْكَ لِتُخْرِجَ النَّاسَ مِنَ الظُّلُمَاتِ إِلَى النُّورِ بِإِذْنِ رَبِّهِمْ	1
Q08058	R005374	6	Ayah	عَالِمُ الْغَيْبِ فَلَا يُظْهِرُ عَلَى غَيْبِهِ أَحَدًا ۝ إِلَّا مَنِ ارْتَضَى مِنْ رَسُولٍ	1
Q08058	R005374	7	Ayah	وَمَا أَرْسَلْنَاكَ إِلَّا رَحْمَةً لِلْعَالَمِينَ	1
Q08058	R005374	9	matn	إنما مثلي ومثل ما بعثني الله به كمثل رجل أتى قومًا فقال: يا قوم إني رأيت الجيش بعيني...	1
Q04682	R005375	1	matn	إِذَا هَمَّ أَحَدُكُمْ بِالأَمْرِ، فَلْيَرْكَعْ رَكْعَتَيْنِ مِنْ غَيْرِ الفَرِيضَةِ، ثُمَّ لِيَقُلْ: اللَّهُمَّ إِنِّي أَسْتَخِيرُكَ بِعِلْمِكَ وَأَسْتَقْدِرُكَ بِقُدْرَتِكَ، وَأَسْأَلُكَ مِنْ فَضْلِكَ العَظِيمِ، فَإِنَّكَ تَقْدِرُ وَلاَ أَقْدِرُ، وَتَعْلَمُ وَلاَ أَعْلَمُ، وَأَنْتَ عَلَّامُ الغُيُوبِ...	1
Q04682	R005375	2	Ayah	فَإِذَا عَزَمْتَ فَتَوَكَّلْ عَلَى اللَّهِ ۚ إِنَّ اللَّهَ يُحِبُّ الْمُتَوَكِّلِينَ	0
Q04682	R005375	3	Ayah	وَعَسَىٰ أَن تَكْرَهُوا شَيْئًا وَهُوَ خَيْرٌ لَّكُمْ ۖ وَعَسَىٰ أَن تُحِبُّوا شَيْئًا وَهُوَ شَرٌّ لَّكُمْ ۗ وَاللَّهُ يَعْلَمُ وَأَنتُمْ لَا تَعْلَمُونَ	0
Q01478	R005376	3	Ayah	وَتَعَاوَنُوا عَلَى الْبِرِّ وَالتَّقْوَى وَلَا تَعَاوَنُوا عَلَى الْإِثْمِ وَالْعُدْوَانِ	0
Q01478	R005376	4	matn	إنَّ الحلالَ بيِّنٌ، وإنَّ الحرامَ بيِّنٌ	0
Q05043	R005377	1	Ayah	إِنَّا أَرْسَلْنَاكَ شَاهِدًا وَمُبَشِّرًا وَنَذِيرًا ۝ لِتُؤْمِنُوا بِاللَّهِ وَرَسُولِهِ وَتُعَزِّرُوهُ وَتُوَقِّرُوهُ	1
Q05043	R005377	2	Ayah	أُولَٰئِكَ الَّذِينَ هَدَى اللَّهُ فَبِهُدَاهُمُ اقْتَدِهْ	1
Q05043	R005377	3	Ayah	وَلَا تَقْفُ مَا لَيْسَ لَكَ بِهِ عِلْمٌ	1
Q05043	R005377	4	matn	من كذب عليَّ متعمداً فليتبوأ مقعده من النار	1
Q05043	R005377	5	Ayah	يَا أَيُّهَا الَّذِينَ آمَنُوا لَا يَسْخَرْ قَوْمٌ مِنْ قَوْمٍ عَسَىٰ أَنْ يَكُونُوا خَيْرًا مِنْهُمْ وَلَا نِسَاءٌ مِنْ نِسَاءٍ عَسَىٰ أَنْ يَكُنَّ خَيْرًا مِنْهُنَّ ۖ وَلَا تَلْمِزُوا أَنْفُسَكُمْ وَلَا تَنَابَزُوا بِالْأَلْقَابِ ۖ بِئْسَ الِاسْمُ الْفُسُوقُ بَعْدَ الْإِيمَانِ ۚ وَمَنْ لَمْ يَتُبْ فَأُولَـٰئِكَ هُمُ الظَّالِمُونَ	1
Q05043	R005377	6	Ayah	لَقَدْ كَانَ فِي قَصَصِهِمْ عِبْرَةٌ لِأُولِي الْأَلْبَابِ	1
Q08309	R005378	1	Ayah	ذَٰلِكَ وَمَن يُعَظِّمْ شَعَائِرَ اللَّهِ فَإِنَّهَا مِن تَقْوَى الْقُلُوبِ	1
Q08309	R005378	2	Ayah	وَقُل لِّعِبَادِي يَقُولُوا الَّتِي هِيَ أَحْسَنُ	1
Q08309	R005378	4	matn	إنَّ اللهَ جميلٌ يحبُّ الجمالَ	1
Q08309	R005378	6	Ayah	كِتَابٌ أَنزَلْنَاهُ إِلَيْكَ مُبَارَكٌ لِّيَدَّبَّرُوا آيَاتِهِ	1
Q07732	R005379	1	Ayah	خُذْ مِنْ أَمْوَالِهِمْ صَدَقَةً تُطَهِّرُهُمْ وَتُزَكِّيهِمْ بِهَا	1
Q07732	R005379	2	Ayah	وَفِي أَمْوَالِهِمْ حَقٌّ لِّلسَّائِلِ وَالْمَحْرُومِ	1
Q07732	R005379	3	Ayah	وَالَّذِينَ يَكْنِزُونَ الذَّهَبَ وَالْفِضَّةَ وَلَا يُنفِقُونَهَا فِي سَبِيلِ اللَّهِ فَبَشِّرْهُم بِعَذَابٍ أَلِيمٍ	1
Q07732	R005379	4	Ayah	وَلَا تُسْرِفُوا ۚ إِنَّهُ لَا يُحِبُّ الْمُسْرِفِينَ	1
Q07732	R005379	5	Ayah	وَالَّذِينَ إِذَا أَنفَقُوا لَمْ يُسْرِفُوا وَلَمْ يَقْتُرُوا وَكَانَ بَيْنَ ذَٰلِكَ قَوَامًا	1
Q07732	R005379	6	matn	ليس الغنى عن كثرة العرض، ولكن الغنى غنى النفس	1
Q07732	R005379	7	Ayah	إِنَّمَا الصَّدَقَاتُ لِلْفُقَرَاءِ وَالْمَسَاكِينِ وَالْعَامِلِينَ عَلَيْهَا...	1
Q07732	R005379	8	Ayah	وَآتُوهُم مِّن مَّالِ اللَّهِ الَّذِي آتَاكُمْ	1
Q07732	R005379	9	matn	كُلُوا واشربوا والبسوا وتصدقوا، في غير إسراف ولا مخيلة	1
Q02998	R005380	2	matn	"إِنِّي أَرَاكَ تُحِبُّ الغَنَمَ وَالبَادِيَةَ، فَإِذَا كُنْتَ فِي غَنَمِكَ، أَوْ بَادِيَتِكَ، فَأَذَّنْتَ بِالصَّلاَةِ فَارْفَعْ صَوْتَكَ بِالنِّدَاءِ، فَإِنَّهُ: لاَ يَسْمَعُ مَدَى صَوْتِ المُؤَذِّنِ، جِنٌّ وَلاَ إِنْسٌ وَلاَ شَيْءٌ، إِلَّا شَهِدَ لَهُ يَوْمَ القِيَامَةِ""**، قال أبو سعيد: سمعته من رسول الله صلى الله عليه وسلم"	1
Q02998	R005380	3	matn	يَعْجَبُ رَبُّكَ مِنْ رَاعِي غَنَمٍ ، فِي رَأْسِ شَظِيَّةِ الْجَبَلِ ، يُؤَذِّنُ بِالصَّلَاةِ ، وَيُصَلِّي فَيَقُولُ اللهُ عَزَّ وَجَلَّ : انْظُرُوا إِلَى عَبْدِي هَذَا يُؤَذِّنُ ، وَيُقِيمُ الصَّلَاةَ ، يَخَافُ مِنِّي قَدْ غَفَرْتُ لِعَبْدِي ، وَأَدْخَلْتُهُ الْجَنَّةَ .	1
Q01205	R005381	1	Ayah	وَكُلُوا وَاشْرَبُوا حَتَّىٰ يَتَبَيَّنَ لَكُمُ الْخَيْطُ الْأَبْيَضُ مِنَ الْخَيْطِ الْأَسْوَدِ مِنَ الْفَجْرِ ثُمَّ أَتِمُّوا الصِّيَامَ إِلَى اللَّيْلِ	1
Q01205	R005381	2	matn	مَن نَسِيَ وهو صائمٌ فأكَل أو شَرِبَ، فَلْيُتِمَّ صَوْمَهُ؛ فإنما أطعمه اللهُ وسقاه	1
Q07811	R005382	1	Ayah	لَا إِكْرَاهَ فِي الدِّينِ	1
Q07811	R005382	2	Ayah	فَمَنْ شَاءَ فَلْيُؤْمِنْ وَمَنْ شَاءَ فَلْيَكْفُرْ	1
Q07811	R005382	3	matn	إنما الأعمال بالنيات، وإنما لكل امرئ ما نوى	1
Q07811	R005382	4	Ayah	إِنَّ اللَّهَ يَأْمُرُ بِالْعَدْلِ وَالْإِحْسَانِ	1
Q07811	R005382	5	Ayah	وَتَعَاوَنُوا عَلَى الْبِرِّ وَالتَّقْوَى	1
Q07811	R005382	6	Ayah	كُنْتُمْ خَيْرَ أُمَّةٍ أُخْرِجَتْ لِلنَّاسِ تَأْمُرُونَ بِالْمَعْرُوفِ وَتَنْهَوْنَ عَنِ الْمُنْكَرِ	1
Q07811	R005382	7	matn	المؤمن للمؤمن كالبنيان يشد بعضه بعضًا	1
Q07811	R005382	8	matn	مثل المؤمنين في توادهم وتراحمهم وتعاطفهم مثل الجسد، إذا اشتكى منه عضو تداعى له سائر الجسد بالسهر والحمى	1
Q07811	R005382	9	Ayah	إِنَّ صَلَاتِي وَنُسُكِي وَمَحْيَايَ وَمَمَاتِي لِلَّهِ رَبِّ الْعَالَمِينَ	1
Q07276	R005383	1	matn	الإسلام أن تشهد أن لا إله إلا الله وأن محمدًا رسول الله، وتقيم الصلاة، وتؤتي الزكاة، وتصوم رمضان، وتحج البيت إن استطعت إليه سبيلًا	1
Q07276	R005383	2	matn	الإيمان أن تؤمن بالله، وملائكته، وكتبه، ورسله، واليوم الآخر، وتؤمن بالقدر خيره وشره	1
Q07276	R005383	3	Ayah	قَالَتِ الْأَعْرَابُ آمَنَّا ۖ قُل لَّمْ تُؤْمِنُوا وَلَٰكِن قُولُوا أَسْلَمْنَا وَلَمَّا يَدْخُلِ الْإِيمَانُ فِي قُلُوبِكُمْ	1
Q07276	R005383	4	matn	الإحسان أن تعبد الله كأنك تراه، فإن لم تكن تراه فإنه يراك	0
Q04849	R005384	1	Ayah	إِنَّ الدِّينَ عِندَ اللَّهِ الْإِسْلَامُ	1
Q04849	R005384	2	Ayah	وَمَن يَبْتَغِ غَيْرَ الْإِسْلَامِ دِينًا فَلَن يُقْبَلَ مِنْهُ وَهُوَ فِي الْآخِرَةِ مِنَ الْخَاسِرِينَ	1
Q04849	R005384	3	Ayah	يَا أَيُّهَا الَّذِينَ آمَنُوا آمِنُوا بِاللَّهِ وَرَسُولِهِ	1
Q04849	R005384	4	Ayah	مَنْ يُطِعِ الرَّسُولَ فَقَدْ أَطَاعَ اللَّهَ	1
Q04849	R005384	5	matn	وَالَّذِي نَفْسُ مُحَمَّدٍ بِيَدِهِ، لا يَسْمَعُ بِي أَحَدٌ مِنْ هَذِهِ الأُمَّةِ، يَهُودِيٌّ وَلا نَصْرَانِيٌّ، ثُمَّ يَمُوتُ وَلَمْ يُؤْمِنْ بِالَّذِي أُرْسِلْتُ بِهِ، إِلا كَانَ مِنْ أَصْحَابِ النَّارِ	1
Q04849	R005384	6	Ayah	وَقَدِمْنَا إِلَىٰ مَا عَمِلُوا مِنْ عَمَلٍ فَجَعَلْنَاهُ هَبَاءً مَنْثُورًا	1
Q04849	R005384	7	Ayah	وَمَن يَكْفُرْ بِالإِيمَانِ فَقَدْ حَبِطَ عَمَلُهُ	1
Q04849	R005384	8	Ayah	وَمَا كُنَّا مُعَذِّبِينَ حَتَّىٰ نَبْعَثَ رَسُولًا	1
Q04849	R005384	9	Ayah	ادْعُ إِلَىٰ سَبِيلِ رَبِّكَ بِالْحِكْمَةِ وَالْمَوْعِظَةِ الْحَسَنَةِ	1
Q04849	R005384	10	Ayah	رُسُلًا مُبَشِّرِينَ وَمُنذِرِينَ لِئَلَّا يَكُونَ لِلنَّاسِ عَلَى اللَّهِ حُجَّةٌ بَعْدَ الرُّسُلِ	1
Q04768	R005385	1	Ayah	إِنَّمَا الْمُؤْمِنُونَ الَّذِينَ آمَنُوا بِاللَّهِ وَرَسُولِهِ ثُمَّ لَمْ يَرْتَابُوا	1
Q04768	R005385	2	Ayah	وَلَكِنْ لِيَطْمَئِنَّ قَلْبِي	1
Q04768	R005385	3	matn	أَوَقَدْ وَجَدْتُمُوهُ؟» قالوا: نعم، قال: «ذَاكَ صَرِيحُ الإِيمَانِ	1
Q04768	R005385	4	matn	يأتي الشيطان أحدكم فيقول: من خلق كذا؟ من خلق كذا؟ حتى يقول: من خلق ربك؟ فإذا بلغه فليستعذ بالله ولينته	1
Q04768	R005385	5	Ayah	فَاعْلَمْ أَنَّهُ لَا إِلَٰهَ إِلَّا اللَّهُ	1
Q04768	R005385	6	Ayah	سَنُرِيهِمْ آيَاتِنَا فِي الْآفَاقِ وَفِي أَنْفُسِهِمْ حَتَّىٰ يَتَبَيَّنَ لَهُمْ أَنَّهُ الْحَقُّ	1
Q04768	R005385	7	Ayah	إِنَّ فِي خَلْقِ السَّمَاوَاتِ وَالْأَرْضِ وَاخْتِلَافِ اللَّيْلِ وَالنَّهَارِ لَآيَاتٍ لِأُولِي الْأَلْبَابِ	1
Q04438	R005386	1	Ayah	قُل مَن يَرزُقُكُم مِنَ السَّماءِ وَالأَرضِ أَمَّن يَملِكُ السَّمعَ وَالأَبصارَ وَمَن يُخرِجُ الحَيَّ مِنَ المَيِّتِ وَيُخرِجُ المَيِّتَ مِنَ الحَيِّ وَمَن يُدَبِّرُ الأَمرَ فَسَيَقولونَ اللَّهُ فَقُل أَفَلا تَتَّقونَ	1
Q04438	R005386	2	Ayah	أَلا لَهُ الخَلقُ وَالأَمرُ تَبارَكَ اللَّهُ رَبُّ العالَمينَ	1
Q04438	R005386	3	Ayah	يُولِجُ اللَّيْلَ فِي النَّهَارِ وَيُولِجُ النَّهَارَ فِي اللَّيْلِ وَسَخَّرَ الشَّمْسَ وَالْقَمَرَ كُلٌّ يَجْرِي لِأَجَلٍ مُّسَمًّى ۚ ذَٰلِكُمُ اللَّهُ رَبُّكُمْ لَهُ الْمُلْكُ ۚ وَالَّذِينَ تَدْعُونَ مِن دُونِهِ مَا يَمْلِكُونَ مِن قِطْمِيرٍ	1
Q04438	R005386	4	Ayah	وَلَقَدْ أُوحِيَ إِلَيْكَ وَإِلَى الَّذِينَ مِن قَبْلِكَ لَئِنْ أَشْرَكْتَ لَيَحْبَطَنَّ عَمَلُكَ وَلَتَكُونَنَّ مِنَ الْخَاسِرِينَ	1
Q04438	R005386	5	matn	"يا مُعاذُ، هلْ تَدْرِي حَقَّ اللَّهِ علَى عِبادِهِ، وما حَقُّ العِبادِ علَى اللَّهِ؟""**، قُلتُ: اللَّهُ ورَسولُهُ أعْلَمُ، قالَ: **""فإنَّ حَقَّ اللَّهِ علَى العِبادِ أنْ يَعْبُدُوهُ ولا يُشْرِكُوا به شيئًا، وحَقَّ العِبادِ علَى اللَّهِ أنْ لا يُعَذِّبَ مَن لا يُشْرِكُ به شيئًا"	1
Q04438	R005386	6	matn	مَن ماتَ وهو يَدْعُو مِن دُونِ اللَّهِ نِدًّا دَخَلَ النَّارَ	1
Q00809	R005387	1	Ayah	وَمَن لَّمْ يُؤْمِن بِاللَّهِ وَرَسُولِهِ فَإِنَّا أَعْتَدْنَا لِلْكَافِرِينَ سَعِيرًا	1
Q00809	R005387	2	Ayah	إِنَّ الَّذِينَ يَكْفُرُونَ بِاللَّهِ وَرُسُلِهِ وَيُرِيدُونَ أَن يُفَرِّقُوا بَيْنَ اللَّهِ وَرُسُلِهِ وَيَقُولُونَ نُؤْمِنُ بِبَعْضٍ وَنَكْفُرُ بِبَعْضٍ وَيُرِيدُونَ أَن يَتَّخِذُوا بَيْنَ ذَٰلِكَ سَبِيلًا (150) أُولَٰئِكَ هُمُ الْكَافِرُونَ حَقًّا ۚ وَأَعْتَدْنَا لِلْكَافِرِينَ عَذَابًا مُّهِينًا (151)	1
Q00809	R005387	3	Ayah	قُلْ يَا أَيُّهَا النَّاسُ إِنِّي رَسُولُ اللَّهِ إِلَيْكُمْ جَمِيعًا الَّذِي لَهُ مُلْكُ السَّمَاوَاتِ وَالْأَرْضِ ۖ لَا إِلَـٰهَ إِلَّا هُوَ يُحْيِي وَيُمِيتُ ۖ فَآمِنُوا بِاللَّهِ وَرَسُولِهِ النَّبِيِّ الْأُمِّيِّ الَّذِي يُؤْمِنُ بِاللَّهِ وَكَلِمَاتِهِ وَاتَّبِعُوهُ لَعَلَّكُمْ تَهْتَدُونَ	1
Q00809	R005387	4	matn	وَالَّذِي نَفْسُ مُحَمَّدٍ بِيَدِهِ، لَا يَسْمَعُ بِي أَحَدٌ مِنْ هَذِهِ الْأُمَّةِ يَهُودِيٌّ، وَلَا نَصْرَانِيٌّ، ثُمَّ يَمُوتُ وَلَمْ يُؤْمِنْ بِالَّذِي أُرْسِلْتُ بِهِ، إِلَّا كَانَ مِنْ أَصْحَابِ النَّارِ	1
Q00809	R005387	5	matn	كُلُّ أُمَّتِي يَدْخُلُونَ الجَنَّةَ إِلَّا مَنْ أَبَى، قَالُوا: يَا رَسُولَ اللَّهِ، وَمَنْ يَأْبَى؟ قَالَ: مَنْ أَطَاعَنِي دَخَلَ الجَنَّةَ، وَمَنْ عَصَانِي فَقَدْ أَبَى	1
Q00809	R005387	6	Ayah	وَمَا كُنَّا مُعَذِّبِينَ حَتَّىٰ نَبْعَثَ رَسُولًا	1
Q08019	R005388	1	Ayah	قُل لَّئِنِ اجْتَمَعَتِ الْإِنسُ وَالْجِنُّ عَلَىٰ أَن يَأْتُوا بِمِثْلِ هَٰذَا الْقُرْآنِ لَا يَأْتُونَ بِمِثْلِهِ وَلَوْ كَانَ بَعْضُهُمْ لِبَعْضٍ ظَهِيرًا	1
Q08019	R005388	2	Ayah	وَإِن كُنتُمْ فِي رَيْبٍ مِّمَّا نَزَّلْنَا عَلَىٰ عَبْدِنَا فَأْتُوا بِسُورَةٍ مِّن مِّثْلِهِ وَادْعُوا شُهَدَاءَكُم مِّن دُونِ اللَّهِ إِن كُنتُمْ صَادِقِينَ	1
Q08019	R005388	3	Ayah	أَفَلَا يَتَدَبَّرُونَ الْقُرْآنَ ۚ وَلَوْ كَانَ مِنْ عِندِ غَيْرِ اللَّهِ لَوَجَدُوا فِيهِ اخْتِلَافًا كَثِيرًا	1
Q08019	R005388	4	Ayah	وَمَا كُنتَ تَتْلُو مِن قَبْلِهِ مِن كِتَابٍ وَلَا تَخُطُّهُ بِيَمِينِكَ ۖ إِذًا لَّارْتَابَ الْمُبْطِلُونَ	1
